name,address
Bến xe Vận tải Nam Hà Nội,"Bến xe Vận tải Nam Hà Nội, Ngõ 785 Trương Định, Giáp Nhị, Hoàng Mai, Hà Nội"
Bến Xe Mỹ Đình,"Bến Xe Mỹ Đình, Mỹ Đình, Nam Từ Liêm, Hà Nội"
Bến Xe Kim Mã,"Bến Xe Kim Mã, Kim Mã, Ba Đình, Hà Nội"
E1.2 Điểm Trung Chuyển Long Biên,"E1.2 Điểm Trung Chuyển Long Biên, Đ. Yên Phụ, Nguyễn Trung Trực, Ba Đình, Hà Nội"
Bến xe Nước Ngầm,"Bến xe Nước Ngầm, 1 Đ. Ngọc Hồi, Hoàng Liệt, Hoàng Mai, Hà Nội"
Bến xe gia lâm,"2R3C+VRM Bến xe gia lâm, Ngã Tư Sở, Đống Đa, Hà Nội"
Bến Xe Trâu Bò Sữa,"Bến Xe Trâu Bò Sữa, Ngõ 53 Nguyễn Khoái, Bạch Đằng, Hai Bà Trưng, Hà Nội"
10-12 Quán Thánh,"10-12 Quán Thánh, P. Quán Thánh, Nguyễn Trung Trực, Ba Đình, Hà Nội"
Bến Xe Giáp Bát,"Bến Xe Giáp Bát, Giải Phóng, Giáp Bát, Hoàng Mai, Hà Nội"
Đối Diện Trung Tâm Thể Thao Hoàng Cầu - Hồ Hoàng Cầu,"Đối Diện Trung Tâm Thể Thao Hoàng Cầu - Hồ Hoàng Cầu, P. Hoàng Cầu, Chợ Dừa, Đống Đa, Hà Nội"
Đại lý vé xe buýt Bến xe Kim Mã,"2RJH+VP3 Đại lý vé xe buýt Bến xe Kim Mã, P. Nguyễn Thái Học, Kim Mã, Đống Đa, Hà Nội"
Bến xe buýt,"Bến xe buýt, 45 P. Khâm Thiên, Thổ Quan, Đống Đa, Hà Nội"
Gò Đống Đa - Tây Sơn,"Gò Đống Đa - Tây Sơn, đối diện 145 P. Tây Sơn, Quang Trung, Đống Đa, Hà Nội"
161 Minh Khai,"161 Minh Khai, 169 P. Minh Khai, Minh Khai, Hai Bà Trưng, Hà Nội"
259 Minh Khai,"259 Minh Khai, 259 P. Minh Khai, Vĩnh Tuy, Hai Bà Trưng, Hà Nội"
Công Viên Lê Nin - Đối Diện 35 Trần Phú,"Công Viên Lê Nin - Đối Diện 35 Trần Phú, 35 P. Trần Phú, Điện Biên, Ba Đình, Hà Nội"
274-276 Khâm Thiên,"274-276 Khâm Thiên, 274 P. Khâm Thiên, Thổ Quan, Đống Đa, Hà Nội"
Bến Xe Nước Ngầm,"Bến Xe Nước Ngầm, Giải Phóng, Hoàng Liệt, Hoàng Mai, Hà Nội"
7 Nguyễn Thái Học,"7 Nguyễn Thái Học, 7-9-11 P. Nguyễn Thái Học, Cửa Nam, Hoàn Kiếm, Hà Nội"
Xe Qbus,"Xe Qbus, Số 51 P. Kim Mã, Kim Mã, Ba Đình, Hà Nội"
Công Ty Vận Tải Hành Khách Bắc Hà,"Công Ty Vận Tải Hành Khách Bắc Hà, Khu Đô Thị Đầm Trấu, 8A2, Quận Hai Bà Trưng, Hà Nội"
216-218 Bạch Mai,"216-218 Bạch Mai, 216 P. Bạch Mai, Cầu Dền, Hai Bà Trưng, Hà Nội"
Đối Diện Bãi Trông Giữ Xe Công Ty Khai Thác Điểm Đỗ Xe Hà Nội Tại 98 Kim Ngưu,"Đối Diện Bãi Trông Giữ Xe Công Ty Khai Thác Điểm Đỗ Xe Hà Nội Tại 98 Kim Ngưu, Thanh Nhàn, Hai Bà Trưng, Hà Nội"
160 Tôn Đức Thắng,"160 Tôn Đức Thắng, 160 P. Tôn Đức Thắng, Hàng Bột, Đống Đa, Hà Nội"
Đối Diện Vincom Tower - Bà Triệu,"Đối Diện Vincom Tower - Bà Triệu, P. Bà Triệu, Lê Đại Hành, Hai Bà Trưng, Hà Nội"
Bến xe Gia lâm,"Bến xe Gia lâm, 22 P. Ngô Gia Khảm, Ngọc Lâm, Long Biên, Hà Nội"
86 Trường Chinh,"86 Trường Chinh, 86 Đ. Trường Chinh, Phương Đình, Thanh Xuân, Hà Nội"
Ga Hà Nội,"Ga Hà Nội, Cửa Nam, Đống Đa, Hà Nội"
254-256 Lê Duẩn,"254-256 Lê Duẩn, 256 Đ. Lê Duẩn, Trung Phụng, Đống Đa, Hà Nội"
339-341 Đê La Thành (Đối Diện ĐH Văn Hóa),"339-341 Đê La Thành (Đối Diện ĐH Văn Hóa), 339 Đ. Đê La Thành, Chợ Dừa, Đống Đa, Hà Nội"
Bến xe buýt Long Biên,"Bến xe buýt Long Biên, Điểm dừng đỗ xe buýt, 32 Phó Đức Chính, Nguyễn Trung Trực, Ba Đình, Hà Nội"
Bến xe Gia Lâm,"Bến xe Gia Lâm, Xe buýt 03, 22, 34 vào- ra xe Gia Lâm Bến, Long Biên, Hà Nội"
263 Thanh Nhàn,"263 Thanh Nhàn, 90 P. Thanh Nhàn, Bạch Mai, Hai Bà Trưng, Hà Nội"
89 Nguyễn Tam Trinh,"89 Nguyễn Tam Trinh, 89 Tam Trinh, Mai Động, Hai Bà Trưng, Hà Nội"
92-94 Bà Triệu,"92-94 Bà Triệu, Trần Hưng Đạo, Hoàn Kiếm, Hà Nội"
19 Nguyễn Biểu,"19 Nguyễn Biểu, 19 Nguyễn Biểu, Quán Thánh, Ba Đình, Hà Nội"
368-370 Bạch Mai,"368-370 Bạch Mai, 368 P. Bạch Mai, Bạch Mai, Hai Bà Trưng, Hà Nội"
Bến xe Kim Mã,"Bến xe Kim Mã, Kim Mã, Ba Đình, Hà Nội"
34 - 36 Hoàng Diệu,"34 - 36 Hoàng Diệu, Hoàng Diệu, Điện Biên, Ba Đình, Hà Nội"
115 Phùng Hưng,"115 Phùng Hưng, 125 P. Phùng Hưng, Phố cổ Hà Nội, Hoàn Kiếm, Hà Nội"
Bến Xe Yên Nghĩa,"Bến Xe Yên Nghĩa, QL6, Phú Lâm, Hà Đông, Hà Nội"
"18, 26","18, 26, 273 P. Thanh Nhàn, Bạch Mai, Hai Bà Trưng, Hà Nội"
Bến xe Gia Lâm,"Bến xe Gia Lâm, 09 P. Ngô Gia Khảm, Ngọc Lâm, Long Biên, Hà Nội"
Khách Sạn Hà Nội,"Khách Sạn Hà Nội, Giảng Võ, Ba Đình, Hà Nội"
Rạp Chiếu Phim Quốc Gia - Thái Hà,"Rạp Chiếu Phim Quốc Gia - Thái Hà, Thái Hà, Chợ Dừa, Hà Nội, Thành Công Đống Đa Hà Nội"
Đối Diện 6C Phan Chu Trinh,"Đối Diện 6C Phan Chu Trinh, Đối diện 6C P. Phan Chu Trinh, Tràng Tiền, Hoàn Kiếm, Hà Nội"
327 Bạch Mai,"327 Bạch Mai, 327 P. Bạch Mai, Bạch Mai, Hai Bà Trưng, Hà Nội"
63 Trần Quang Diệu,"63 Trần Quang Diệu, 63 P. Trần Quang Diệu, Chợ Dừa, Đống Đa, Hà Nội"
Đối Diện 311 Kim Mã (Gần Ngã 4 Kim Mã - Vạn Bảo),"Đối Diện 311 Kim Mã (Gần Ngã 4 Kim Mã - Vạn Bảo), 300 P. Kim Mã, Kim Mã, Ba Đình, Hà Nội"
512-514 Bạch Mai,"512-514 Bạch Mai, 512 P. Bạch Mai, Trương Định, Hai Bà Trưng, Hà Nội"
195B Đội Cấn,"195B Đội Cấn, 195B P. Đội Cấn, Đội Cấn, Ba Đình, Hà Nội"
67 Trần Hưng Đạo,"67 Trần Hưng Đạo, 67 Trần Hưng Đạo, Hoàn Kiếm, Hà Nội"
Đối Diện 34A Trần Phú,"Đối Diện 34A Trần Phú, P. Trần Phú, Điện Biên, Ba Đình, Hà Nội"
49 Hai Bà Trưng - Tháp Hà Nội,"49 Hai Bà Trưng - Tháp Hà Nội, Trần Hưng Đạo, Hoàn Kiếm, Hà Nội"
153 - 155 Đặng Tiến Đông,"153 - 155 Đặng Tiến Đông, 153 P. Đặng Tiến Đông, Trung Liệt, Đống Đa, Hà Nội"
22B Hai Bà Trưng,"22B Hai Bà Trưng, 22B P. Hai Bà Trưng, Tràng Tiền, Hoàn Kiếm, Hà Nội"
12A Điện Biên Phủ,"12A Điện Biên Phủ, 12A Điện Biên Phủ, Điện Biên, Ba Đình, Hà Nội"
Thành Cổ Hà Nội - Đối Diện 38 Phan Đình Phùng,"Thành Cổ Hà Nội - Đối Diện 38 Phan Đình Phùng, Quán Thánh, Ba Đình, Hà Nội"
283 Tôn Đức Thắng,"283 Tôn Đức Thắng, 281 P. Tôn Đức Thắng, Thổ Quan, Đống Đa, Hà Nội"
423 Minh Khai,"423 Minh Khai, 461 P. Minh Khai, Vĩnh Tuy, Hai Bà Trưng, Hà Nội"
Bộ Y Tế - 138A Giảng Võ,"Bộ Y Tế - 138A Giảng Võ, 138A P. Giảng Võ, Kim Mã, Ba Đình, Hà Nội"
Bến Xe Mỹ Đình,"2QHH+4G2 Bến Xe Mỹ Đình, Phạm Hùng, Mỹ Đình, Từ Liêm, Hà Nội"
319 Phố Huế,"319 Phố Huế, 319 P. Huế, Lê Đại Hành, Hai Bà Trưng, Hà Nội"
Qua Viện Tin Học Pháp Ngữ 20M - Lê Thanh Nghị,"Qua Viện Tin Học Pháp Ngữ 20M - Lê Thanh Nghị, P. Lê Thanh Nghị, Bách Khoa, Hai Bà Trưng, Hà Nội"
Xí nghiệp xe khách nam Hà Nội,"Xí nghiệp xe khách nam Hà Nội, Khu phường, Đền Lừ 1 Đ. Hoàng Mai, Hoàng Văn Thụ, Hoàng Mai, Hà Nội"
Hiệp Hội Vận Tải Thành Phố Hà Nội,"Hiệp Hội Vận Tải Thành Phố Hà Nội, Khâm Thiên, Đống Đa, Hà Nội"
Số 3 Hàng Muối,"Số 3 Hàng Muối, 3 P. Hàng Muối, Phố cổ Hà Nội, Hoàn Kiếm, Hà Nội"
E6 Quỳnh Mai,"E6 Quỳnh Mai, Đối diện E6 P. Kim Ngưu, Quỳnh Mai, Hai Bà Trưng, Hà Nội"
167 Phùng Hưng,"167 Phùng Hưng, 167 P. Phùng Hưng, Phố cổ Hà Nội, Hoàn Kiếm, Hà Nội"
Đối Diện Bệnh Viện Xanh Pôn - 60 Trần Phú (Bộ Tư Pháp),"Đối Diện Bệnh Viện Xanh Pôn - 60 Trần Phú (Bộ Tư Pháp), Số, 60 P. Trần Phú, Ba Đình, Hà Nội"
"26, 30, 38, 42","26, 30, 38, 42, Đối diện 305 Tam Trinh, Hoàng Văn Thụ, Hoàng Mai, Hà Nội"
240 Kim Mã,"240 Kim Mã, 240 P. Kim Mã, Kim Mã, Ba Đình, Hà Nội"
Cột Cờ Hà Nội - Điện Biên Phủ,"Cột Cờ Hà Nội - Điện Biên Phủ, Điện Biên Phủ, Điện Biên, Ba Đình, Hà Nội"
Đài Tưởng Niệm Khâm Thiên - 45 Khâm Thiên,"Đài Tưởng Niệm Khâm Thiên - 45 Khâm Thiên, Khâm Thiên, Đống Đa, Hà Nội"
36 Lý Thái Tổ - Cung Thiếu Nhi Hà Nội,"36 Lý Thái Tổ - Cung Thiếu Nhi Hà Nội, French Quarter, Lý Thái Tổ, Hoàn Kiếm, Hà Nội"
BẾN XE KHÁCH NƯỚC NGẦM,"BẾN XE KHÁCH NƯỚC NGẦM, 1 Đ. Ngọc Hồi, Văn Điển, Thanh Trì, Hà Nội"
Bưu Điện Thành Phố Hà Nội - 75B Đinh Tiên Hoàng,"Bưu Điện Thành Phố Hà Nội - 75B Đinh Tiên Hoàng, 75 P. Đinh Tiên Hoàng, French Quarter, Hoàn Kiếm, Hà Nội"
95 Giảng Võ,"95 Giảng Võ, 125 P. Giảng Võ, Chợ Dừa, Đống Đa, Hà Nội"
Đối Diện Tập Thể Bến Xe Nước Ngầm Hà Nội - Ngọc Hồi,"Đối Diện Tập Thể Bến Xe Nước Ngầm Hà Nội - Ngọc Hồi, Hoàng Liệt, Hoàng Mai, Hà Nội"
147 Nguyễn Thái Học,"147 Nguyễn Thái Học, 145 Nguyễn Thái Học, Cát Linh, Đống Đa, Hà Nội"
358-360 Lê Duẩn,"358-360 Lê Duẩn, Đối diện 388 Đ. Lê Duẩn, Phương Liên, Đống Đa, Hà Nội"
Đối Diện 807 Giải Phóng,"Đối Diện 807 Giải Phóng, Giải Phóng, Định Công, Hai Bà Trưng, Hà Nội"
57A Huỳnh Thúc Kháng,"57A Huỳnh Thúc Kháng, Láng Hạ, Đống Đa, Hà Nội"
Xí nghiệp xe buýt Thăng Long,"Xí nghiệp xe buýt Thăng Long, lô 7, lô 7 Đền Lừ, Hoàng Mai, Hà Nội"
Công Viên Nghĩa Đô,"Công Viên Nghĩa Đô, Đ. Nguyễn Văn Huyên, Dịch Vọng, Cầu Giấy, Hà Nội"
3A Phan Đình Phùng,"3A Phan Đình Phùng, P. Phan Đình Phùng, Quán Thánh, Hoàn Kiếm, Hà Nội"
Bệnh Viện Việt Đức - 40 Tràng Thi,"Bệnh Viện Việt Đức - 40 Tràng Thi, 40 P. Tràng Thi, Hàng Bông, Hoàn Kiếm, Hà Nội"
276 Tôn Đức Thắng,"276 Tôn Đức Thắng, 276 P. Tôn Đức Thắng, Hàng Bột, Đống Đa, Hà Nội"
Chợ Mơ - 459D Bạch Mai,"Chợ Mơ - 459D Bạch Mai, 459 P. Bạch Mai, Trương Định, Hai Bà Trưng, Hà Nội"
Kim Ngưu,"Kim Ngưu, P. Kim Ngưu, Thanh Nhàn, Hai Bà Trưng, Hà Nội"
"Viet Anh Investment - Transport Co.,Ltd","Viet Anh Investment - Transport Co.,Ltd, 222, Hong Mai Street, Hai Ba Trung District, Ha Noi City"
197 Đại La,"197 Đại La, 197 Đại La, Đồng Tâm, Hai Bà Trưng, Hà Nội"
194-196 Trương Định,"194-196 Trương Định, 194 Trương Định, Hai Bà Trưng, Hà Nội"
23-25 Hoàng Cầu,"23-25 Hoàng Cầu, 21 Hoàng Cầu (CTCPTM Sài Gòn Bank) P. Hoàng Cầu, Chợ Dừa, Đống Đa, Hà Nội"
Đối Diện 702 Đê La Thành,"Đối Diện 702 Đê La Thành, 621 Đ. Đê La Thành, Thành Công, Ba Đình, Hà Nội"
Đối Diện Tháp Hà Nội - Hai Bà Trưng (Cạnh 56 Hai Bà Trưng),"Đối Diện Tháp Hà Nội - Hai Bà Trưng (Cạnh 56 Hai Bà Trưng), Trần Hưng Đạo, Hoàn Kiếm, Hà Nội"
658 Trương Định,"658 Trương Định, 658 Trương Định, Giáp Bát, Hoàng Mai, Hà Nội"
251-253 Nguyễn Tam Trinh,"251-253 Nguyễn Tam Trinh, 251 Tam Trinh, Hoàng Văn Thụ, Hoàng Mai, Hà Nội"
25A-25B Phố Huế,"25A-25B Phố Huế, 25 P. Huế, Hàng Bài, Hoàn Kiếm, Hà Nội"
376-378 Lĩnh Nam,"376-378 Lĩnh Nam, 378 Đ. Lĩnh Nam, Lĩnh Nam, Hai Bà Trưng, Hà Nội"
18 Nguyễn Khoái,"18 Nguyễn Khoái, 3 Nguyễn Khoái, Bạch Đằng, Hai Bà Trưng, Hà Nội"
Đối Diện Tượng Đài Bắc Sơn - Hoàng Diệu,"Đối Diện Tượng Đài Bắc Sơn - Hoàng Diệu, Hoàng Diệu, Quán Thánh, Ba Đình, Hà Nội"
"09, 36","09, 36, P. Lê Thái Tổ, Hàng Trống, Hoàn Kiếm, Hà Nội"
18 Lý Thường Kiệt - Tổng Công Ty Du Lịch Hà Nội,"18 Lý Thường Kiệt - Tổng Công Ty Du Lịch Hà Nội, Phan Chu Trinh, Hoàn Kiếm, Hà Nội"
91-93 Lê Hồng Phong,"91-93 Lê Hồng Phong, Điện Biên, Ba Đình, Hà Nội"
80 Trần Nhật Duật,"80 Trần Nhật Duật, 80 Trần Nhật Duật, Phố cổ Hà Nội, Hoàn Kiếm, Hà Nội"
"A Chau Service And Trade Co.,Ltd","A Chau Service And Trade Co.,Ltd, 249 Kim Ma Street, Ba Dinh District, Ha Noi City"
d'LIONS Restaurant,"d'LIONS Restaurant, 92 Đ. Lê Duẩn, Văn Miếu, Hoàn Kiếm, Hà Nội"
MẸT Vietnamese Restaurant & Vegetarian Met 2,"MẸT Vietnamese Restaurant & Vegetarian Met 2, 42 P. Lương Văn Can, Hàng Gai, Hoàn Kiếm, Hà Nội 11015"
Nhà Hàng Nam Phương - Hà Nội,"Nhà Hàng Nam Phương - Hà Nội, 19 P. Phan Chu Trinh, Phan Chu Trinh, Hoàn Kiếm, Hà Nội 11021"
Nhà hàng Vị An,"Nhà hàng Vị An, 145 P. Hoàng Cầu, Chợ Dừa, Đống Đa, Hà Nội 100000"
Nhà Hàng Hải Sư,"Nhà Hàng Hải Sư, 111-k1 P. Giảng Võ, Chợ Dừa, Đống Đa, Hà Nội"
Nhà hàng Cánh Buồm,"Nhà hàng Cánh Buồm, 150 Đ. Trường Chinh, Khương Thượng, Đống Đa, Hà Nội"
Essence Restaurant,"Essence Restaurant, 38A P. Trần Phú, Điện Biên, Ba Đình, Hà Nội 10000"
Nhà hàng Hải sản Tomato,"Nhà hàng Hải sản Tomato, 82 P. Lê Văn Hưu, Hàng Bài, Hoàn Kiếm, Hà Nội"
Nhà hàng,"Nhà hàng, 56 P. Huế, Bùi Thị Xuân, Hai Bà Trưng, Hà Nội"
Nhà hàng Ngự Uyển,"Nhà hàng Ngự Uyển, C4, 104, Đống Đa, Hà Nội"
Long Wang - Lẩu Hấp Thủy Nhiệt Hồng Kông - 84 Ngọc Khánh,"Long Wang - Lẩu Hấp Thủy Nhiệt Hồng Kông - 84 Ngọc Khánh, 84 P. Ngọc Khánh, Giảng Võ, Ba Đình, Hà Nội 100000"
Nhà hàng Nấm Việt Hà Thành,"Nhà hàng Nấm Việt Hà Thành, 76 P. Lò Đúc, Phạm Đình Hổ, Hai Bà Trưng, Hà Nội"
Trung tâm tiệc cưới Long Vĩ,"Trung tâm tiệc cưới Long Vĩ, 3A P. Đào Duy Anh, Phương Mai, Đống Đa, Hà Nội"
Thế Giới Hải Sản - Seafood World - 75A Trần Hưng Đạo,"Thế Giới Hải Sản - Seafood World - 75A Trần Hưng Đạo, 75A Trần Hưng Đạo, Hoàn Kiếm, Hà Nội"
Hansarang Nhà hàng Hàn Quốc,"Hansarang Nhà hàng Hàn Quốc, 464 P. Bạch Mai, Trương Định, Hai Bà Trưng, Hà Nội"
Nhà Hàng,"Nhà Hàng, 10 P. Đặng Tiến Đông, Quang Trung, Đống Đa, Hà Nội"
Nhà Hàng Phương Nam - Quán ăn miền tây ở Hà Nội,"Nhà Hàng Phương Nam - Quán ăn miền tây ở Hà Nội, The Golden Palm, Tầng 1 tòa nhà, số 21 Đ. Lê Văn Lương, Thanh Xuân, Hà Nội 100000"
Khuê Restaurant,"Khuê Restaurant, 46A P. Nguyễn Trường Tộ, Trúc Bạch, Ba Đình, Hà Nội 10000"
Nhà Hàng Jacksons Steakhouse,"Nhà Hàng Jacksons Steakhouse, 23J P. Hai Bà Trưng, Hàng Bài, Hoàn Kiếm, Hà Nội"
Nhà Hàng Nét Huế,"Nhà Hàng Nét Huế, 153 P. Láng Hạ, Láng Hạ, Đống Đa, Hà Nội 100000"
Ngon Garden,"Ngon Garden, 70 P. Nguyễn Du, Trần Hưng Đạo, Hai Bà Trưng, Hà Nội"
Nhà hàng Quảng Đông Fu Rong Hua,"Nhà hàng Quảng Đông Fu Rong Hua, 9 P. Đinh Tiên Hoàng, Hàng Trống, Hoàn Kiếm, Hà Nội"
SUSHI ICHI,"SUSHI ICHI, 98 P. Nguyễn Hữu Huân, Hàng Bạc, Hoàn Kiếm, Hà Nội 00084"
Ha Noi Best,"Ha Noi Best, 7a P. Đinh Liệt, Hàng Đào, Hoàn Kiếm, Hà Nội"
Nhà hàng Ẩm Thực Phố,"Nhà hàng Ẩm Thực Phố, 51 P. Giang Văn Minh, Kim Mã, Ba Đình, Hà Nội 100000"
The Rhythms Restaurant,"The Rhythms Restaurant, 33-35 P. Hàng Dầu, street, Hoàn Kiếm, Hà Nội 100000"
Góc Hà Nội,"Góc Hà Nội, 160 P. Ô Chợ Dừa, Chợ Dừa, Đống Đa, Hà Nội"
Nét Huế Restaurant,"Nét Huế Restaurant, 198 P. Hàng Bông, Hàng Bông, Hoàn Kiếm, Hà Nội"
Nhà hàng Chen by NamChen,"Nhà hàng Chen by NamChen, 116 P. Hoàng Ngân, Trung Hoà, Cầu Giấy, Hà Nội"
Jaspas,"Jaspas, Hanoi Tower, 49 P. Hai Bà Trưng, Trần Hưng Đạo, Hoàn Kiếm, Hà Nội"
El Gaucho | Tràng Tiền,"El Gaucho | Tràng Tiền, 11 Tràng Tiền, Hoàn Kiếm, Hà Nội"
Era Restaurant- Vietnamese cuisine,"Era Restaurant- Vietnamese cuisine, 48 P. Mã Mây, Hàng Buồm, Hoàn Kiếm, Hà Nội 100000"
Quán An Ngon,"Quán An Ngon, 18 P. Phan Bội Châu, Cửa Nam, Hoàn Kiếm, Hà Nội 111103"
Hong Hoai's Vietnamese Restaurant & Vegan Food,"Hong Hoai's Vietnamese Restaurant & Vegan Food, 20 P. Bát Đàn, Hàng Bồ, Hoàn Kiếm, Hà Nội 100000"
Nguyên Sinh Hà Nội Restaurant Francais,"Nguyên Sinh Hà Nội Restaurant Francais, 17 P. Lý Quốc Sư, Hàng Trống, Hoàn Kiếm, Hà Nội"
Pk Spice Indian Restaurant,"Pk Spice Indian Restaurant, 42 P. Hàng Hòm, Hàng Gai, Hoàn Kiếm, Hà Nội 100000"
Nhà Hàng Khoa Ngan,"Nhà Hàng Khoa Ngan, 77 P. Hai Bà Trưng, Cửa Nam, Hoàn Kiếm, Hà Nội"
Madam Tran Restaurant & Cookingclass Best Vietnamese Restaurant & Vegan Foods,"Madam Tran Restaurant & Cookingclass Best Vietnamese Restaurant & Vegan Foods, 42B P. Đào Duy Từ, Hàng Buồm, Hoàn Kiếm, Hà Nội 100000"
Salmonoid,"Salmonoid, 32C P. Cao Bá Quát, Điện Biên, Ba Đình, Hà Nội 118719"
Hải sản Xô Seafood,"Hải sản Xô Seafood, 112 P. Ô Chợ Dừa, Chợ Dừa, Đống Đa, Hà Nội"
Nhà Hàng Chợ Quê Hoàng Ngân,"Nhà Hàng Chợ Quê Hoàng Ngân, 1 Ng. 163 P. Hoàng Ngân, Trung Hoà, Cầu Giấy, Hà Nội 100000"
Ming Restaurant,"Ming Restaurant, Khách sạn Pan Pacific Hanoi, 1 Đ. Thanh Niên, Trúc Bạch, Ba Đình, Hà Nội"
Cloud Nine Restaurant,"Cloud Nine Restaurant, 27 P. Hàng Bè, Phố cổ Hà Nội, Hoàn Kiếm, Hà Nội 100000"
First Restaurant,"First Restaurant, 12 P. Tràng Thi, Street, Hoàn Kiếm, Hà Nội"
Tung's Kitchen Vietnamese Cuisine & Vegetarian Food,"Tung's Kitchen Vietnamese Cuisine & Vegetarian Food, 2 P. Hàng Bông, Hàng Gai, Hoàn Kiếm, Hà Nội 100000"
Downtown Cafe & Restaurant,"Downtown Cafe & Restaurant, 07 P. Hàng Muối, St, Hoàn Kiếm, Hà Nội 100000"
San Fu Lou Phan Chu Trinh (Nhà Hát Lớn Hà Nội),"San Fu Lou Phan Chu Trinh (Nhà Hát Lớn Hà Nội), 6 P. Phan Chu Trinh, Tràng Tiền, Hoàn Kiếm, Hà Nội"
Buffet Chef Dzung,"Buffet Chef Dzung, 71 Đ. Nguyễn Chí Thanh, Thành Công, Ba Đình, Hà Nội 100000"
Nhà hàng Asahi Sushi,"Nhà hàng Asahi Sushi, 288 P. Bà Triệu, Lê Đại Hành, Hai Bà Trưng, Hà Nội"
Gyu-Kaku Japanese BBQ,"Gyu-Kaku Japanese BBQ, V Tower, 1, 649 P. Kim Mã, Ngọc Khánh, Ba Đình, Hà Nội"
Nhà hàng Tầm Vị,"Nhà hàng Tầm Vị, 4b P. Yên Thế, Văn Miếu, Đống Đa, Hà Nội"
Nhà Hàng,"Nhà Hàng, 26 P. Linh Lang, Cống Vị, Ba Đình, Hà Nội"
Softwater Restaurant,"Softwater Restaurant, 42 Đ. 9, Tập thể F361 An Dương, Tây Hồ, Hà Nội 100000"
Tim Ho Wan Restaurant,"Tim Ho Wan Restaurant, Lotte Center HàNội, 36Floor, 54 P. Liễu Giai, Hà Nội"
Địa Chỉ Ẩm Thực Hà Nội - Món ngon Hà Nội,"Địa Chỉ Ẩm Thực Hà Nội - Món ngon Hà Nội, TOÀ SUNRISE, 57 P. Láng Hạ, Thành Công, Ba Đình, Hà Nội"
Nhà hàng sang trọng CRUs,"Nhà hàng sang trọng CRUs, 102 P. Ngọc Hà, Ngọc Hồ, Ba Đình, Hà Nội"
Bò Tơ Quán Mộc Hoa Lư,"Bò Tơ Quán Mộc Hoa Lư, 02 P. Hoa Lư, Lê Đại Hành, Hai Bà Trưng, Hà Nội 100000"
Nhà hàng Hatoyama - 13 Lý Thường Kiệt,"Nhà hàng Hatoyama - 13 Lý Thường Kiệt, 13 P. Lý Thường Kiệt, Phan Chu Trinh, Hoàn Kiếm, Hà Nội 100000"
Xôi Yến,"Xôi Yến, 35b P. Nguyễn Hữu Huân, Hàng Bạc, Hoàn Kiếm, Hà Nội 100000"
Nhà hàng Góc Quê,"Nhà hàng Góc Quê, 19 Ng. 183 Đặng Tiến Đông, Trung Liệt, Đống Đa, Hà Nội"
Home Mộc Restaurant,"Home Mộc Restaurant, 75 P. Nguyễn Đình Chiểu, Lê Đại Hành, Hai Bà Trưng, Hà Nội"
GIANG restaurant,"GIANG restaurant, 10a P. Khúc Hạo, Điện Biên, Ba Đình, Hà Nội 03000"
Nhà Hàng San Hô Hà Nội,"Nhà Hàng San Hô Hà Nội, 58 P. Lý Thường Kiệt, Trần Hưng Đạo, Hoàn Kiếm, Hà Nội"
Hải Sản Tươi Ngon - Ô Chợ Dừa,"Hải Sản Tươi Ngon - Ô Chợ Dừa, 108 P. Ô Chợ Dừa, Chợ Dừa, Đống Đa, Hà Nội"
Nhà hàng Quán Đỏ,"Nhà hàng Quán Đỏ, 63 P. Vũ Thạnh, Chợ Dừa, Đống Đa, Hà Nội"
Rice Bistro,"Rice Bistro, 32 P. Hàng Mành, Hàng Gai, Hoàn Kiếm, Hà Nội"
Long Wang - Lẩu Hấp Thủy Nhiệt Hồng Kông - 539 Minh Khai,"Long Wang - Lẩu Hấp Thủy Nhiệt Hồng Kông - 539 Minh Khai, 539 P. Minh Khai, Vĩnh Phú, Hai Bà Trưng, Hà Nội 100000"
Bít Tết Ngọc Hiếu - Hoà Mã,"Bít Tết Ngọc Hiếu - Hoà Mã, 52 P. Lê Ngọc Hân, Ngô Thì Nhậm, Hai Bà Trưng, Hà Nội"
Nhà hàng Hanoi Garden,"Nhà hàng Hanoi Garden, 36 P. Hàng Mành, Hàng Gai, Hoàn Kiếm, Hà Nội 100000"
Nhà hàng,"Nhà hàng, Đ. Nguyễn Trãi, Thanh Xuân Trung, Hoàn Kiếm, Hà Nội"
November Restaurant,"November Restaurant, 105 P. Nguyễn Trường Tộ, Quán Thánh, Ba Đình, Hà Nội 100000"
Bò Tơ Quán Mộc 84 Ngọc Khánh,"Bò Tơ Quán Mộc 84 Ngọc Khánh, 84 P. Ngọc Khánh, Giảng Võ, Ba Đình, Hà Nội 100000"
Nét Huế Times,"Nét Huế Times, 458 P. Minh Khai, Vĩnh Phú, Hai Bà Trưng, Hà Nội 100000"
Nhà Hàng Chả Cá Lão Ngư,"Nhà Hàng Chả Cá Lão Ngư, 171 P. Thái Hà, Láng Hạ, Đống Đa, Hà Nội"
Sen Trang An Vietnamese Restaurant,"Sen Trang An Vietnamese Restaurant, 43 P. Hàng Bè, Hàng Bạc, Hoàn Kiếm, Hà Nội"
Quán Nhỏ,"Quán Nhỏ, 31 P. Láng Hạ, Chợ Dừa, Ba Đình, Hà Nội 10000"
Bếp Thái Koh Yam - Bà Triệu,"Bếp Thái Koh Yam - Bà Triệu, 3 Ng. Bà Triệu, Lê Đại Hành, Hai Bà Trưng, Hà Nội"
Ashima Giang Văn Minh,"Ashima Giang Văn Minh, 60 P. Giang Văn Minh, Đội Cấn, Ba Đình, Hà Nội 100000"
The Eroica Restaurant,"The Eroica Restaurant, 12-14 P. Đình Ngang, Cửa Nam, Hoàn Kiếm, Hà Nội 100000"
Hoang's Restaurant,"Hoang's Restaurant, 54 P. Hàng Buồm, Hàng Buồm, Hoàn Kiếm, Hà Nội 100000"
Món Ngon Hà Nội,"Món Ngon Hà Nội, 25 P. Hàng Bè, Hàng Bạc, Hoàn Kiếm, Hà Nội"
GU Bistronomy,"GU Bistronomy, 60 P. Nguyễn Thị Định, Trung Hoà, Thanh Xuân, Hà Nội 100000"
Press Club Hanoi,"Press Club Hanoi, 12 P. Lý Đạo Thành, Tràng Tiền, Hoàn Kiếm, Hà Nội"
Bò Tơ Quán Mộc 02 Đặng Dung,"Bò Tơ Quán Mộc 02 Đặng Dung, 2 P. Đặng Dung, Quán Thánh, Ba Đình, Hà Nội"
Nhà hàng Xô Viết,"Nhà hàng Xô Viết, 103, Nha TT Mac-Lenin Ngõ 84 Phố Ngọc Khánh, Ng. 84 P. Ngọc Khánh, Ba Đình, Hà Nội 100000"
Nha Hang Bun,"Nha Hang Bun, 100 P. Hàng Bún, Quán Thánh, Ba Đình, Hà Nội"
Oven d'Or Restaurant,"Oven d'Or Restaurant, Sheraton Hotel, K5 Nghi Tam, Road, 11 Đ. Xuân Diệu, Quảng An, Tây Hồ, Hà Nội"
Bò Tơ Quán Mộc Thái Thịnh,"Bò Tơ Quán Mộc Thái Thịnh, 102 P. Thái Thịnh, Ngã Tư Sở, Đống Đa, Hà Nội 100000"
Lẩu bò ba toa Nam Cóc,"Lẩu bò ba toa Nam Cóc, 2 P. An Trạch, Cát Linh, Đống Đa, Hà Nội"
LẨU NGON HÀ NỘI - 65 Lạc Trung,"LẨU NGON HÀ NỘI - 65 Lạc Trung, 65 P. Lạc Trung, Vĩnh Tuy, Hai Bà Trưng, Hà Nội 100000"
Thế Giới Hải Sản - 36 Điện Biên Phủ,"Thế Giới Hải Sản - 36 Điện Biên Phủ, 36 Điện Biên Phủ, Điện Biên, Ba Đình, Hà Nội 100000"
Grille6 Steakhouse,"Grille6 Steakhouse, 184 P. Hào Nam, Chợ Dừa, Đống Đa, Hà Nội"
Mr.TukTuk - Nhà hàng Thái,"Mr.TukTuk - Nhà hàng Thái, 57 P. Chùa Láng, Láng Thượng, Đống Đa, Hà Nội 100000"
Oriana Vietnamese Restaurant and Vegetarian/Vegan Foods,"Oriana Vietnamese Restaurant and Vegetarian/Vegan Foods, 38 P. Lò Sũ, Lý Thái Tổ, Hoàn Kiếm, Hà Nội 100000"
Nhà hàng Kim Long,"Nhà hàng Kim Long, D8 P. Trần Huy Liệu, Giảng Võ, Ba Đình, Hà Nội"
Nhà Hàng Hà Nội Phố,"Nhà Hàng Hà Nội Phố, Cổng, Toà nhà Chelsea Residences, P. Trần Kim Xuyến/48 P. Hạ Yên Quyết, Yên Hoà, Cầu Giấy, Hà Nội 100000"
Nét Huế,"Nét Huế, 54A Đ. Nguyễn Chí Thanh, Láng Thượng, Ba Đình, Hà Nội 100000"
Nhà Hàng Quán Cũ,"Nhà Hàng Quán Cũ, 31A P. Phan Đình Phùng, Quán Thánh, Ba Đình, Hà Nội 100000"
Hanoi Corner Restaurant,"Hanoi Corner Restaurant, 11 P. Hàng Bè, Hàng Bạc, Hoàn Kiếm, Hà Nội 11011"
Nhà Hàng Maison Hoàng Cầu,"Nhà Hàng Maison Hoàng Cầu, 36A Bán Đảo, P. Hoàng Cầu, Chợ Dừa, Đống Đa, Hà Nội"
The Gourmet Corner,"The Gourmet Corner, 22 Ta Hien street Hoan Kiem district Hanoi City, 10000"
Nét Huế - 57 Lạc Trung,"Nét Huế - 57 Lạc Trung, 57 P. Lạc Trung, Vĩnh Tuy, Hai Bà Trưng, Hà Nội 100000"
Quán Ốc Cay Hồng Lai,"Quán Ốc Cay Hồng Lai, B1, 109 P. Trần Huy Liệu, Giảng Võ, Ba Đình, Hà Nội"
Nhà Hàng Hana,"Nhà Hàng Hana, 111A5 P. Vạn Phúc, Liễu Giai, Ba Đình, Hà Nội"
Som Tum Thai - Vincom Metropolis,"Som Tum Thai - Vincom Metropolis, Level 2(L2-02,03) Vincom Center Metropolis, 29 P. Liễu Giai, Hà Nội, 100000"
Quán Xưa,"Quán Xưa, 59/25 P. Láng Hạ, Chợ Dừa, Ba Đình, Hà Nội"
Sadhu Vegetarian Restaurant,"Sadhu Vegetarian Restaurant, 87 P. Lý Thường Kiệt, Cửa Nam, Hoàn Kiếm, Hà Nội"
French Grill,"French Grill, 8 Do Duc Duc, Me Tri, South Tu Liem, Hanoi, Hà Nội 100000"
Gia Ngư Restaurant,"Gia Ngư Restaurant, 27-29 Gia Ngu Street, Hoan Kiem Dist, Hanoi City, Hà Nội 100000"
