name,address
Karaoke 47 Nghi Tàm,"Karaoke 47 Nghi Tàm, Đường Nghi Tàm, Yên Phụ, Tây Hồ, Hà Nội"
Karaoke Palace,"Karaoke Palace, 135 Nghi Tàm, Yên Phụ, Tây Hồ, Hà Nội 100000"
Karaoke Star World,"Karaoke Star World, 107 P. Đào Tấn, Khánh, Ba Đình, Hà Nội"
5 Sao Karaoke-96 Thái Thịnh Đống Đa,"5 Sao Karaoke-96 Thái Thịnh Đống Đa, 96 P. Thái Thịnh, Ngã Tư Sở, Đống Đa, Hà Nội"
Karaoke Joker,"Karaoke Joker, 80 P. Triệu Việt Vương, Bùi Thị Xuân, Hai Bà Trưng, Hà Nội"
Karaoke Sunny Royal,"Karaoke Sunny Royal, 13 P. Lê Văn Linh, Hàng Mã, Hoàn Kiếm, Hà Nội"
Karaoke New King Club,"Karaoke New King Club, 104AE3 P. Thái Thịnh, Trung Liệt, Đống Đa, Hà Nội"
Karaoke MoonLight,"Karaoke MoonLight, 54 P. Chùa Láng, Láng Thượng, Đống Đa, Hà Nội"
Karaoke The voice,"Karaoke The voice, 173, Quan Hoa, Cầu Giấy, Hà Nội 11306"
Karaoke Liberty,"Karaoke Liberty, 408 Đê la Thành, Chợ Dừa, Đống Đa, Hà Nội"
Karaoke Kenz Club,"Karaoke Kenz Club, 202 P. Trung Kính, Yên Hoà, Cầu Giấy, Hà Nội"
King Karaoke,"2R82+986 King Karaoke, P. Lưu Quang Vũ, Trung Hoà, Cầu Giấy, Hà Nội"
Karaoke TiTan 14 Vũ Phạm Hàm,"Karaoke TiTan 14 Vũ Phạm Hàm, 14 P. Vũ Phạm Hàm, Trung Hoà, Cầu Giấy, Hà Nội 100000"
Karaoke iSing,"Karaoke iSing, 158 Đ. Lê Duẩn, Khâm Thiên, Đống Đa, Hà Nội 100000"
Karaoke Lục Giác,"Karaoke Lục Giác, 20 P. Nguyễn Thị Định, Trung Hoà, Cầu Giấy, Hà Nội"
Karaoke ZOZO 12 Trần Kim Xuyến,"Karaoke ZOZO 12 Trần Kim Xuyến, 12 P. Trần Kim Xuyến, Yên Hoà, Cầu Giấy, Hà Nội 100000"
Karaoke Thuỳ Linh,"Karaoke Thuỳ Linh, 27 Đ. Lê Văn Lương, Nhân Chính, Thanh Xuân, Hà Nội 10000"
Karaoke Grand 300 Xã Đàn,"Karaoke Grand 300 Xã Đàn, 300 P. Xã Đàn, Phương Liên, Đống Đa, Hà Nội"
Cheering Beer 27 Lê Văn Lương,"Cheering Beer 27 Lê Văn Lương, 27 Đ. Lê Văn Lương, Nhân Chính, Thanh Xuân, Hà Nội 100000"
Karaoke New 292 Bạch Đằng,"Karaoke New 292 Bạch Đằng, 292 Đ. Bạch Đằng, Chương Dương Độ, Hoàn Kiếm, Hà Nội"
Karaoke ATC,"Karaoke ATC, 171 Đ. Nguyễn Ngọc Vũ, Trung Hoà, Cầu Giấy, Hà Nội"
Karaoke Pattaya Club,"Karaoke Pattaya Club, 192 Đ. Nguyễn Tuân, Nhân Chính, Thanh Xuân, Hà Nội"
Karaoke Magic,"Karaoke Magic, 65 P. Thái Thịnh, Thịnh Quang, Đống Đa, Hà Nội"
Karaoke Aso,"Karaoke Aso, 86 P. Khâm Thiên, Thổ Quan, Đống Đa, Hà Nội"
Karaoke SoHot,"Karaoke SoHot, 31 P. Chùa Láng, Láng Thượng, Đống Đa, Hà Nội"
Bin Bo Karaoke,"Bin Bo Karaoke, 11 Ng. 10 P. Láng Hạ, Thành Công, Ba Đình, Hà Nội 100000"
Karaoke Golden 299 Xã Đàn,"Karaoke Golden 299 Xã Đàn, 299 P. Xã Đàn, Nam Đồng, Đống Đa, Hà Nội"
Karaoke F5 Trần Duy Hưng,"Karaoke F5 Trần Duy Hưng, 5 Đ. Trần Duy Hưng, Trung Hoà, Cầu Giấy, Hà Nội"
Karaoke WINE 2002,"Karaoke WINE 2002, 2b Đ. Nguyễn Khang, Yên Hoà, Cầu Giấy, Hà Nội"
Karaoke Hero,"Karaoke Hero, 117 P.Trung Hòa, Yên Hoà, Cầu Giấy, Hà Nội"
Karaoke Hoàng Gia 85 Nguyễn Khang,"Karaoke Hoàng Gia 85 Nguyễn Khang, 85 Đ. Nguyễn Khang, Yên Hoà, Cầu Giấy, Hà Nội"
Karaoke Trần Thái Tông,"Karaoke Trần Thái Tông, 58 P.Trần Thái Tông, Dịch Vọng, Cầu Giấy, Hà Nội"
Karaoke Nhất Thống,"Karaoke Nhất Thống, P. Thi Sách, Ngô Thì Nhậm, Hai Bà Trưng, Hà Nội 100000"
Karaoke vũ hải,"Karaoke vũ hải, Ng. 143 P. Quan Hoa, Quan Hoa, Cầu Giấy, Hà Nội"
Karaoke Sunny Royal - 215 Xã Đàn,"Karaoke Sunny Royal - 215 Xã Đàn, 215 P. Xã Đàn, Nam Đồng, Đống Đa, Hà Nội 100000"
Karaoke Summit 64 Trần Thái Tông,"Karaoke Summit 64 Trần Thái Tông, 64 P.Trần Thái Tông, Dịch Vọng Hậu, Cầu Giấy, Hà Nội"
Karaoke TIPTOP,"Karaoke TIPTOP, 85g Đ. Nguyễn Khang, Yên Hoà, Cầu Giấy, Hà Nội"
NEWLIFE KARAOKE,"NEWLIFE KARAOKE, 378 Đ. Kim Giang, Đại Kim, Hoàng Mai, Hà Nội 100000"
Karaoke Olala,"Karaoke Olala, 86 P. Nguyễn Hoàng, Mỹ Đình, Nam Từ Liêm, Hà Nội"
Karaoke Vip,"Karaoke Vip, 10 P. Hoàng Ngọc Phách, Khu tập thể Nam Thành Công, Đống Đa, Hà Nội"
Karaoke New 194 Trần Duy Hưng,"Karaoke New 194 Trần Duy Hưng, 194 Đ. Trần Duy Hưng, Trung Hoà, Cầu Giấy, Hà Nội 100000"
Karaoke Hoàng Hải 136,"Karaoke Hoàng Hải 136, 17 Ng. 64 Đ. Cổ Linh, Long Biên, Hà Nội"
Karaoke ising 116 Trần Duy Hưng,"Karaoke ising 116 Trần Duy Hưng, 116 Đ. Trần Duy Hưng, Láng Thượng, Cầu Giấy, Hà Nội 100000"
Karaoke New Star,"Karaoke New Star, Hồ Điều Hòa (Hồ/32 Đền Lừ 3, Hoàng Văn Thụ, Hoàng Mai, Hà Nội 100000"
Karaoke Kenvin,"Karaoke Kenvin, 56 P.Trần Thái Tông, Dịch Vọng Hậu, Cầu Giấy, Hà Nội"
Karaoke Monaco,"Karaoke Monaco, 235 Đ. Lê Đức Thọ, Mỹ Đình, Nam Từ Liêm, Hà Nội 100000"
Karaoke London Restaurant,"Karaoke London Restaurant, 28 P. Thành Thái, Dịch Vọng, Cầu Giấy, Hà Nội"
Karaoke Fantasy,"Karaoke Fantasy, 201 P. Bạch Mai, Thanh Nhàn, Hai Bà Trưng, Hà Nội"
Santana Karaoke,"Santana Karaoke, 36 P. Nguyễn Hoàng, Mỹ Đình, Nam Từ Liêm, Hà Nội"
Karaoke Eva,"Karaoke Eva, 54 P.Trần Thái Tông, Dịch Vọng Hậu, Cầu Giấy, Hà Nội"
5 Sao Karaoke-645 Tân Mai Hoàng Mai,"5 Sao Karaoke-645 Tân Mai Hoàng Mai, 645 -H5 P. Tân Mai, Tân Mai, Hoàng Mai, Hà Nội"
BAR LOUNGE SOPHIE,"BAR LOUNGE SOPHIE, No 25/53 P. Linh Lang, Cống Vị, Ba Đình, Hà Nội"
Karaoke Ngọc Bentley,"Karaoke Ngọc Bentley, 33 P. Nguyên Khiết, Phúc Tân, Hoàn Kiếm, Hà Nội"
Karaoke Level,"Karaoke Level, 36 P. Vũ Trọng Khánh, P. Mộ Lao, Hà Đông, Hà Nội 100000"
Cafe Phố Nhỏ,"Cafe Phố Nhỏ, 32 P. Cao Bá Quát, Điện Biên, Ba Dinh District, Hà Nội"
Karaoke Xuân Ý,"Karaoke Xuân Ý, 241 P. Phúc Tân, Phúc Tân, Hoàn Kiếm, Hà Nội"
Karaoke X4,"Karaoke X4, 6 P. Phạm Thận Duật, Mai Dịch, Cầu Giấy, Hà Nội"
Karaoke Suối Nhạc,"Karaoke Suối Nhạc, 61 P. Hoàng Văn Thái, Khương Mai, Thanh Xuân, Hà Nội 100000"
Karaoke Seoul,"Karaoke Seoul, 12/63 Đ. Phú Mỹ, Mỹ Đình, Nam Từ Liêm, Hà Nội"
5 Sao Karaoke-473 Hoàng Quốc Việt Bắc Từ Liêm,"5 Sao Karaoke-473 Hoàng Quốc Việt Bắc Từ Liêm, 473 Hoàng Quốc Việt, Cổ Nhuế, Bắc Từ Liêm, Hà Nội 100000"
KARAOKE GOLDEN,"KARAOKE GOLDEN, 80 P. Trần Đại Nghĩa, Đồng Tâm, Hai Bà Trưng, Hà Nội"
Karaoke XO 70 nguyễn khánh toàn,"Karaoke XO 70 nguyễn khánh toàn, 70 Đ. Nguyễn Khánh Toàn, Quan Hoa, Cầu Giấy, Hà Nội 12345"
Karaoke Grammy,"Karaoke Grammy, 331 Đ. La Thành, Chợ Dừa, Đống Đa, Hà Nội"
Karaoke vol 1 Nguyễn Lân,"Karaoke vol 1 Nguyễn Lân, 20 P. Nguyễn Lân, Phương Liệt, Thanh Xuân, Hà Nội"
Karaoke Noucamp,"Karaoke Noucamp, 12 P. Miếu Đầm, Mễ Trì thượng, Nam Từ Liêm, Hà Nội"
Karaoke Crown,"Karaoke Crown, 32 P. Mai Dịch, Mai Dịch, Cầu Giấy, Hà Nội"
Karaoke X.O Club,"Karaoke X.O Club, Ng. 4/11 P. Đồng Me, Mễ Trì, Nam Từ Liêm, Hà Nội"
Karaoke Amigo,"Karaoke Amigo, 233 Đ. Lê Đức Thọ, Mỹ Đình, Nam Từ Liêm, Hà Nội 100000"
Karaoke,"Karaoke, 82 P.Phạm Ngọc Thạch, Quang Trung, Đống Đa, Hà Nội 100000"
Karaoke Honey,"Karaoke Honey, 83 P. Hồ Đắc Di, Nam Đồng, Đống Đa, Hà Nội 100000"
Karaoke Bích Anh,"Karaoke Bích Anh, 28 Phố Hàn Thuyên, Hai Bà Trưng, Phan Chu Trinh, Hai Bà Trưng, Hà Nội"
Karaoke 69,"Karaoke 69, 73 P. Vũ Tông Phan, Khương Trung, Thanh Xuân, Hà Nội 100000"
Karaoke Cung Chơn,"Karaoke Cung Chơn, 32, Vũ Phạm Hàm, Phường Yên Hòa, Quận Cầu Giấy, Thành Phố Hà Nội, Yên Hoà, Cầu Giấy, Hà Nội"
Karaoke X9,"Karaoke X9, 10 P. Trần Quý Cáp, Văn Miếu, Đống Đa, Hà Nội"
Karaoke Galaxy,"Karaoke Galaxy, 80 P. Trần Nguyên Đán, Định Công, Hoàng Mai, Hà Nội"
Karaoke Pharaon,"Karaoke Pharaon, 41 P. Phùng Khoang, Trung Văn, Nam Từ Liêm, Hà Nội"
Tiệm Karaoke,"Tiệm Karaoke, 478, Xuân Đỉnh, Quận Bắc Từ Liêm, Thành Phố Hà Nội, Xuân Đỉnh, Hà Nội"
Cafe - Karaoke Thu Trang,"Cafe - Karaoke Thu Trang, 29 P. Phú Viên, Bồ Đề, Long Biên, Hà Nội"
Karaoke Suối Nhạc,"Karaoke Suối Nhạc, 34 P. Tram, Long Biên, Hà Nội"
Karaoke Hương Giang,"Karaoke Hương Giang, 79 P. Thái Thịnh, Thịnh Quang, Đống Đa, Hà Nội"
Karaoke BOX,"Karaoke BOX, Lk 26-27-28, Khu đô thị Bắc Hà, Hà Đông, 12100"
Sân vận động Trường Đại học Bách Khoa Hà Nội,"Sân vận động Trường Đại học Bách Khoa Hà Nội, A1 P. Lê Thanh Nghị, Bách Khoa, Hai Bà Trưng, Hà Nội"
Sân vận động Hàng Đẫy,"Sân vận động Hàng Đẫy, 9 P. Trịnh Hoài Đức, Cát Linh, Đống Đa, Hà Nội"
Sân Bóng Đá Chu Văn An,"Sân Bóng Đá Chu Văn An, 10 Đ. Thụy Khuê, Thuỵ Khuê, Ba Đình, Hà Nội"
Sân vận động Quốc gia Mỹ Đình,"Sân vận động Quốc gia Mỹ Đình, 1 Đ. Lê Đức Thọ, Mỹ Đình, Nam Từ Liêm, Hà Nội"
Sân vận động trường Đại học Sư phạm Hà Nội,"Sân vận động trường Đại học Sư phạm Hà Nội, 136 Xuân Thủy, Dịch Vọng Hậu, Cầu Giấy, Hà Nội"
Sân bóng Đại học Quốc Gia Hà Nội,"2QQJ+XV7 Sân bóng Đại học Quốc Gia Hà Nội, Trường Đại học Ngoại ngữ, Dịch Vọng Hậu, Cầu Giấy, Hà Nội"
Sân Vận Động Quận Hoàng Mai,"XR6H+G4V Sân Vận Động Quận Hoàng Mai, Linh Đường, Hoàng Mai, Hà Nội"
Sân Bóng Đá Tân Mai,"Sân Bóng Đá Tân Mai, Tân Mai, Hai Bà Trưng, Hà Nội"
Sân vận động C500,"Sân vận động C500, P. Văn Quán, Hà Đông, Hà Nội"
Sân Bóng Đá Đại Học Y,"Sân Bóng Đá Đại Học Y, 1 P. Tôn Thất Tùng, Kim Liên, Đống Đa, Hà Nội"
Sân Bóng Hoàng Cầu,"Sân Bóng Hoàng Cầu, 69 P. Hoàng Cầu, Chợ Dừa, Đống Đa, Hà Nội"
Sân bóng vận động viên cấp cao,"Sân bóng vận động viên cấp cao, Mỹ Đình, Từ Liêm, Hà Nội"
Sân Vận Động Bộ Công An,"XRC9+4V8 Sân Vận Động Bộ Công An, Đ.Thanh Liệt, Thanh Liệt, Thanh Trì, Hà Nội"
Sân bóng đá Pháp Vân,"Sân bóng đá Pháp Vân, Hoàng Liệt, Hoàng Mai, Hà Nội"
sân vận động thôn Cổ Điển,"4Q5X+38Q sân vận động thôn Cổ Điển, Đê Tả Sông Hồng, Hải Bối, Đông Anh, Hà Nội"
Sân Vận Động Thanh Trì,"WRRX+74F Sân Vận Động Thanh Trì, Tứ Hiệp, Thanh Trì, Hà Nội"
Sân Cỏ Nhân Tạo Học Viện Kĩ Thuật Quân Sự,"2QXP+84W Sân Cỏ Nhân Tạo Học Viện Kĩ Thuật Quân Sự, Cổ Nhuế, Từ Liêm, Hà Nội"
Sân Bóng Long Biên,"Sân Bóng Long Biên, 7 P .Nguyễn Tư Giản, Phúc Tân, Hoàn Kiếm, Hà Nội"
Sân vận động cỏ nhân tạo Đông Mỹ,"Sân vận động cỏ nhân tạo Đông Mỹ, Đông Mỹ, Thanh Trì, Hà Nội"
Sân Cầu Lông 178 Đường Láng,"Sân Cầu Lông 178 Đường Láng, 178 Đ. Láng, Thịnh Quang, Đống Đa, Hà Nội"
Sân Bóng Đại Học Hà Nội,"Sân Bóng Đại Học Hà Nội, Đại Học Hà Nội, P. Văn Quán, Hà Đông, Hà Nội"
Sân bóng Thượng Đình,"Sân bóng Thượng Đình, 129 Nguyễn Trãi, Thượng Đình, Thanh Xuân, Hà Nội"
Sân Vận Động VSA2,"XRVJ+JHW Sân Vận Động VSA2, P. Lê Trọng Tấn, Khương Mai, Thanh Xuân, Hà Nội"
Công Ty,"Công Ty, 36 Ng. 1D P. Trần Quang Diệu, Chợ Dừa, Đống Đa, Hà Nội"
Thành Lập Công Ty Tại Hà Nội,"Thành Lập Công Ty Tại Hà Nội, 16 Đ. Nguyễn Chí Thanh, Láng Hạ, Đống Đa, Hà Nội 100000"
Văn phòng Cty Băng dính - Màng PE Hanopro,"Văn phòng Cty Băng dính - Màng PE Hanopro, 10 P. Nhân Hòa, Nhân Chính, Thanh Xuân, Hà Nội 100000"
Công ty Cổ phần thương mại và sản xuất THQ- Pháp,"Công ty Cổ phần thương mại và sản xuất THQ- Pháp, Ng. Hòa Bình 7/48/46 P. Minh Khai, Minh Khai, Hai Bà Trưng, Hà Nội"
Ty,"Ty, 50 P. Tây Sơn, Quang Trung, Hoàn Kiếm, Hà Nội"
Công ty Cổ phần Tư vấn Kiến trúc Đô thị Hà Nội - UAC,"Công ty Cổ phần Tư vấn Kiến trúc Đô thị Hà Nội - UAC, 25 P. Bùi Ngọc Dương, Bạch Mai, Hai Bà Trưng, Hà Nội"
Công Ty May Thăng Long,"Công Ty May Thăng Long, 250 P. Minh Khai, Minh Khai, Hai Bà Trưng, Hà Nội"
Công ty Cổ phần Tư vấn và Xây dựng Môi trường TNT Việt Nam,"Công ty Cổ phần Tư vấn và Xây dựng Môi trường TNT Việt Nam, 19 P. Nguyễn Phúc Lai, Chợ Dừa, Đống Đa, Hà Nội"
Chống Thấm Thành Tâm – Thi Công Chống Thấm Dột Tại Hà Nội,"Chống Thấm Thành Tâm – Thi Công Chống Thấm Dột Tại Hà Nội, 15 P. Lý Nam Đế, Hàng Mã, Hoàn Kiếm, Hà Nội"
CÔNG TY CỔ PHẦN THƯƠNG MẠI VÀ CUNG CẤP DỊCH VỤ TAPRO,"CÔNG TY CỔ PHẦN THƯƠNG MẠI VÀ CUNG CẤP DỊCH VỤ TAPRO, tổ 28D Ng. 523 Minh Khai, Thanh Lương, Hai Bà Trưng, Hà Nội"
Công ty,"Công ty, 166 Khuất Duy Tiến, Nhân Chính, Thanh Xuân, Hà Nội"
Tư Vấn Thành Lập Doanh Nghiệp Tại Hà Nội,"Tư Vấn Thành Lập Doanh Nghiệp Tại Hà Nội, 123 Đ. Lê Duẩn, Văn Miếu, Đống Đa, Hà Nội 100000"
Diệt Mối Tại Quận Đống Đa - Hà Nội giá Rẻ,"Diệt Mối Tại Quận Đống Đa - Hà Nội giá Rẻ, 56 P. Xã Đàn, Nam Đồng, Đống Đa, Hà Nội 100000"
Công ty CP đá khô Hà Nội,"Công ty CP đá khô Hà Nội, 7 P. Thái Hà, Trung Liệt, Đống Đa, Hà Nội"
Công ty cổ phần kho vận & dich vụ thương mại ( VINATRANCO ),"Công ty cổ phần kho vận & dich vụ thương mại ( VINATRANCO ), 473 P. Minh Khai, Vĩnh Tuy, Hai Bà Trưng, Hà Nội"
Cty TNHH Made Việt,"Cty TNHH Made Việt, 57 P. Trần Quang Diệu, Chợ Dừa, Đống Đa, Hà Nội"
Công Ty CP Phần mềm Hà Nội,"Công Ty CP Phần mềm Hà Nội, 134 P. Mai Anh Tuấn, Chợ Dừa, Đống Đa, Hà Nội"
Công ty,"Công ty, 214/5 Đ. Nguyễn Xiển, Tổ 12, Thanh Xuân, Hà Nội"
Công Ty Cp Xd Số 1 Hà Nội,"Công Ty Cp Xd Số 1 Hà Nội, 59 P. Quang Trung, Nguyễn Du, Hai Bà Trưng, Hà Nội"
CN bán SRX345 ở Hà nội,"CN bán SRX345 ở Hà nội, H2 P. Lạc Trung, Vĩnh Tuy, Hai Bà Trưng, Hà Nội"
Công ty TNHH Đầu Tư Sản Xuất Và Thương Mại Đại Kim,"Công ty TNHH Đầu Tư Sản Xuất Và Thương Mại Đại Kim, Lô 1B Trung Yên 11, Trung Hoà, Cầu Giấy, Hà Nội"
Công ty TNHH IN INT Việt Nam,
Công Ty Nước Sạch Hà Nội - Nhà Máy Nước Lương Yên,"Công Ty Nước Sạch Hà Nội - Nhà Máy Nước Lương Yên, 11 Đ. Đê Trần Khát Chân, Đống Mác, Hai Bà Trưng, Hà Nội"
CÔNG TY TNHH MỘT THÀNH VIÊN KINH DOANH DỊCH VỤ NHÀ HÀ NỘI,"CÔNG TY TNHH MỘT THÀNH VIÊN KINH DOANH DỊCH VỤ NHÀ HÀ NỘI, 25 P. Văn Miếu, Văn Miếu, Đống Đa, Hà Nội"
Công Ty Cổ Phần Đầu Tư Và Sản Xuất Canavi,"Công Ty Cổ Phần Đầu Tư Và Sản Xuất Canavi, 1194/136/3 Ng. 850 Đ. Láng, Quang Trung, Hoàn Kiếm, Hà Nội"
"Công ty Lotus Việt - thiết kế, thi công gian hàng triển lãm, event, showroom, cửa hàng","Công ty Lotus Việt - thiết kế, thi công gian hàng triển lãm, event, showroom, cửa hàng, 459C P. Bạch Mai, Trương Định, Hai Bà Trưng, Hà Nội"
Công Ty Trần Thành,"Công Ty Trần Thành, 110 P. Nguyễn Du, Cửa Nam, Hai Bà Trưng, Hà Nội"
Công ty Cổ Phần Sản Xuất và Dịch Vụ Cảnh Quan Minh Khôi,"Công ty Cổ Phần Sản Xuất và Dịch Vụ Cảnh Quan Minh Khôi, 269 P. An Dương, Yên Phụ, Tây Hồ, Hà Nội"
chân không Fami ở Hà Nội,"chân không Fami ở Hà Nội, 750 Đ. Bạch Đằng, Bạch Đằng, Hai Bà Trưng, Hà Nội"
Công ty cổ phần Tư Vấn Đánh Giá và Phát Triển Giáo Dục EDUTALK,"Công ty cổ phần Tư Vấn Đánh Giá và Phát Triển Giáo Dục EDUTALK, 20 Ng. 41 P. Vọng, Đồng Tâm, Hai Bà Trưng, Hà Nội"
Công ty Cổ phần thương mại và Xuất nhập khẩu Hiển Anh,"Công ty Cổ phần thương mại và Xuất nhập khẩu Hiển Anh, 7/187, P. Trung Kính, Yên Hoà, Cầu Giấy, Hà Nội"
Công ty Cổ phần Bao Bì 277 Hà Nội,"Công ty Cổ phần Bao Bì 277 Hà Nội, No.4 P. Láng Hạ, Thành Công, Ward, Hà Nội 100000"
Công ty Cổ phần thiết kế kiến trúc và nội thất Art Việt,"Công ty Cổ phần thiết kế kiến trúc và nội thất Art Việt, 32 P. Hào Nam, Chợ Dừa, Đống Đa, Hà Nội"
CÔNG TY TNHH THƯƠNG MẠI MỸ VIỆT,"CÔNG TY TNHH THƯƠNG MẠI MỸ VIỆT, 46 P. Bích Câu, Quốc Tử Giám, Đống Đa, Hà Nội"
Công ty,"XQF7+F6J Công ty, Khu đô thị Văn Khê, Hà Đông, Hà Nội"
Công Ty CP đầu tư bất động sản Hà Nội,"Công Ty CP đầu tư bất động sản Hà Nội, 148 P. Xã Đàn, Nam Đồng, Đống Đa, Hà Nội"
Công Ty Cổ Phần Đỗ Đầu Việt Nam,"Công Ty Cổ Phần Đỗ Đầu Việt Nam, 29 P. Quốc Tử Giám, Văn Chương, Đống Đa, Hà Nội"
CÔNG TY CỔ PHẦN KINH DOANH VÀ ĐẦU TƯ VIỆT HÀ,"CÔNG TY CỔ PHẦN KINH DOANH VÀ ĐẦU TƯ VIỆT HÀ, Số 254 P. Minh Khai, Vĩnh Tuy, Hai Bà Trưng, Hà Nội"
Công Ty Ðầu Tư Và Dịch Vụ Tuổi Trẻ Hà Nội,"Công Ty Ðầu Tư Và Dịch Vụ Tuổi Trẻ Hà Nội, Số 1 P. Võ Thị Sáu, Thanh Nhàn, Hai Bà Trưng, Hà Nội"
Công ty,"XQFJ+G79 Công ty, Đ. Nguyễn Xiển, P. Văn Quán, Hoàng Mai, Hà Nội"
Công Ty Cổ Phần Sản Xuất Và Thương Mại Dịch Vụ Tân Hải Triều,"Công Ty Cổ Phần Sản Xuất Và Thương Mại Dịch Vụ Tân Hải Triều, 21 Ng. Thống Nhất, Trương Định, Hai Bà Trưng, Hà Nội"
Công Ty Cổ Phần Sản Xuất Và Thương Mại Hùng Nguyên Hn,"Công Ty Cổ Phần Sản Xuất Và Thương Mại Hùng Nguyên Hn, 3/75, P. Thái Hà, Trung Liệt, Hoàn Kiếm, Hà Nội"
Công Ty Kim Khí Thăng Long,"Công Ty Kim Khí Thăng Long, 2 P. Giảng Võ, Kim Mã, Đống Đa, Hà Nội"
Công ty vietracimex,"Công ty vietracimex, 926 Đ. Bạch Đằng, Thanh Lương, Hai Bà Trưng, Hà Nội"
Công ty cổ phần công nghệ Vi Mô,"Công ty cổ phần công nghệ Vi Mô, 18 Tam Trinh, Mai Động, Hai Bà Trưng, Hà Nội"
Công Ty Cổ Phần Thực Phẩm Dinh Dưỡng Hà Nội - Hanufood,"Công Ty Cổ Phần Thực Phẩm Dinh Dưỡng Hà Nội - Hanufood, 33 P. Lạc Trung, Vĩnh Tuy, Hai Bà Trưng, Hà Nội"
Công Ty Cổ Phần Sản Xuất Và Thương Mại Thành An,"Công Ty Cổ Phần Sản Xuất Và Thương Mại Thành An, 33 P. Đốc Ngữ, Vĩnh Phú, Hoàn Kiếm, Hà Nội"
Công ty diệt mối diệt côn trùng từ Mỹ,"Công ty diệt mối diệt côn trùng từ Mỹ, Tầng 13 tháp Hà Nội Tower, 49 P. Hai Bà Trưng, Trần Hưng Đạo, Hoàn Kiếm, Hà Nội"
Công Ty Tnhh Bách Linh,"Công Ty Tnhh Bách Linh, 33 P. Thợ Nhuộm, Hàng Bông, Hoàn Kiếm, Hà Nội"
Công Ty Cổ Phần Sản Xuất Và Thương Mại Fuka Việt Nam,"Công Ty Cổ Phần Sản Xuất Và Thương Mại Fuka Việt Nam, 56 P. Hào Nam, Chợ Dừa, Hoàn Kiếm, Hà Nội"
Công Ty Tnhh Taihei International Việt Nam,"Hà Nội, Hoàn Kiếm, P. Núi Trúc, 7F, Lancaster Công Ty Tnhh Taihei International Việt Nam"
Công ty cổ phần LUDI,
CÔNG TY CỔ PHẦN ĐẦU TƯ QUỐC TẾ VÀ XUẤT NHẬP KHẨU DHT,"CÔNG TY CỔ PHẦN ĐẦU TƯ QUỐC TẾ VÀ XUẤT NHẬP KHẨU DHT, 35 P. Lê Văn Thiêm, Thanh Xuân Trung, Thanh Xuân, Hà Nội 10000"
Công ty,"Công ty, NO 09, LK9, 31, La Khê, Hà Đông, Hà Nội"
Tổng công ty Dược Việt Nam - CTCP,"Tổng công ty Dược Việt Nam - CTCP, 12 P. Ngô Tất Tố, Văn Miếu, Đống Đa, Hà Nội"
Công ty cổ phần sản xuất và thương mại P.P,"Công ty cổ phần sản xuất và thương mại P.P, 101A P. Nguyễn Khuyến, Văn Miếu, Đống Đa, Hà Nội 100000"
Xí nghiệp vận dụng toa xe hàng Hà Nội,"Xí nghiệp vận dụng toa xe hàng Hà Nội, 130 Đ. Lê Duẩn, Văn Chương, Hoàn Kiếm, Hà Nội"
Công Ty Dịch Thuật Công Chứng SNU Hà Nội,"Công Ty Dịch Thuật Công Chứng SNU Hà Nội, 64A P. Quán Sứ, Trần Hưng Đạo, Hoàn Kiếm, Hà Nội 11019"
Tổng Công Ty Lắp Máy Việt Nam (Lilama),"Tổng Công Ty Lắp Máy Việt Nam (Lilama), Tòa nhà LILAMA, 124 P. Minh Khai, Trương Định, Hai Bà Trưng, Hà Nội"
My Hanoi,"My Hanoi, 5 Ng. Mai Hương, Bạch Mai, Hai Bà Trưng, Hà Nội"
Công ty TNHH MTV Nhà ở và Đô thị LICOGI,"Công ty TNHH MTV Nhà ở và Đô thị LICOGI, Đường Hạnh Phúc, Hoàng Văn Thụ, Hoàng Mai, Hà Nội"
Công ty Dây & Cáp điện Vạn Xuân Aguststar,"Công ty Dây & Cáp điện Vạn Xuân Aguststar, 41 P. Hàng Cháo, Cát Linh, Đống Đa, Hà Nội"
Công Ty Tnhh Sakura,"Công Ty Tnhh Sakura, 90B P. Bùi Thị Xuân, Bùi Thị Xuân, Hai Bà Trưng, Hà Nội"
Công ty XKLD Bảo Ngọc Vinagimex,"Công ty XKLD Bảo Ngọc Vinagimex, 149 P. Giảng Võ, Chợ Dừa, Đống Đa, Hà Nội"
Vinacontrol Hà nội,"Vinacontrol Hà nội, 96 P. Yết Kiêu, Nguyễn Du, Hai Bà Trưng, Hà Nội"
bệ hạ,"bệ hạ, 129 P. Bích Câu, Quốc Tử Giám, Đống Đa, Hà Nội"
Công ty TNHH XNK Đầu tư An Bình,"Công ty TNHH XNK Đầu tư An Bình, 233 P. Khâm Thiên, Thổ Quan, Đống Đa, Hà Nội"
Hanoi Etoco,"Hanoi Etoco, 142 Đ. Lê Duẩn, Khâm Thiên, Đống Đa, Hà Nội"
Công Ty bảo Chi,"Công Ty bảo Chi, 34 Ng. 98 P. Khâm Thiên, Khâm Thiên, Đống Đa, Hà Nội"
Chi nhánh Công ty TNHH MTV SOTRANS Logistics tại Hà Nội (SOTRANS Logistics Hà Nội),"Chi nhánh Công ty TNHH MTV SOTRANS Logistics tại Hà Nội (SOTRANS Logistics Hà Nội), 142 P. Đội Cấn, Đội Cấn, Ba Đình, Hà Nội"
CÔNG TY CỔ PHẦN Ỷ VÂN HIÊN,"CÔNG TY CỔ PHẦN Ỷ VÂN HIÊN, 15 Ng. 87 Đ. Tam Trinh, Mai Động, Hoàng Mai, Hà Nội"
Công ty TNHH thương mại quốc tế Lamei Việt Nam,"Công ty TNHH thương mại quốc tế Lamei Việt Nam, 13 Ng. Hòa Bình 1, Minh Khai, Hai Bà Trưng, Hà Nội"
Công ty cổ phần buffco,"Công ty cổ phần buffco, 40k Ng. Hoà Bình 2, Minh Khai, Hai Bà Trưng, Hà Nội"
CN Hà Nội công ty Đồ Uống Truyền Thống Việt Nam,"CN Hà Nội công ty Đồ Uống Truyền Thống Việt Nam, 52 Ng. 84 P. Võ Thị Sáu, Thanh Nhàn, Hai Bà Trưng, Hà Nội"
Công Ty Cp Khóa Minh Khai,"Công Ty Cp Khóa Minh Khai, 121 P. Minh Khai, Minh Khai, Hai Bà Trưng, Hà Nội"
Công Ty Cổ Phần Tư Vấn Và Xây Dựng 789 Land,"Công Ty Cổ Phần Tư Vấn Và Xây Dựng 789 Land, 190/8/5A Đ. Hoàng Mai, Hoàng Văn Thụ, Hoàng Mai, Hà Nội"
Công Ty Cổ Phần Sao Đại Dương,"Công Ty Cổ Phần Sao Đại Dương, 9 Ngõ 281/5, Nguyễn Tam Trinh, Q. Hai Bà Trưng, Hà Nội, Bạch Mai, Hai Bà Trưng, Hà Nội"
Công ty cổ phần Chứng khoán VPS,"Công ty cổ phần Chứng khoán VPS, 2a Đại Cồ Việt, Lê Đại Hành, Hai Bà Trưng, Hà Nội 100000"
Công ty thang máy Hà Nội - HANEC,"Công ty thang máy Hà Nội - HANEC, Lô 7 Đền Lừ 1, Hoàng Văn Thụ, Hoàng Mai, Hà Nội"
Công Ty Cổ Phần Sản Xuất Và Thương Mại Tsk Việt Nam,"Công Ty Cổ Phần Sản Xuất Và Thương Mại Tsk Việt Nam, 157/31 P. Pháo Đài Láng, Láng Thượng, Đống Đa, Hà Nội"
BOO MEDIA - Phóng sự cưới chuyên nghiệp Hà Nội,"BOO MEDIA - Phóng sự cưới chuyên nghiệp Hà Nội, 36 ngõ 251, Kim Mã, Ba Đình, Hà Nội"
CÔNG TY TNHH MỘT THÀNH VIÊN SẢN XUẤT VÀ THƯƠNG MẠI NHẬT MINH HIẾU,"CÔNG TY TNHH MỘT THÀNH VIÊN SẢN XUẤT VÀ THƯƠNG MẠI NHẬT MINH HIẾU, 29B Ng. 58 P. Trần Bình, Mai Dịch, Cầu Giấy, Hà Nội"
Công Ty Trang Thiết Bị Y Tế Ánh Ngọc,"Công Ty Trang Thiết Bị Y Tế Ánh Ngọc, Ng. Thái Hà/61 P. Thái Hà, Láng Hạ, Đống Đa, Hà Nội 000084"
Công Ty TNHH Thiên Đạt,"Công Ty TNHH Thiên Đạt, Số Nhà 8 B2 Tổ 33, Phường Phương Liên, Quận Đống Đa, Văn Miếu, Đống Đa, Hà Nội"
Công ty Cổ phần Chứng khoán Vina,"Công ty Cổ phần Chứng khoán Vina, Tòa nhà Capital Building, 58 P. Kim Mã, Kim Mã, Ba Đình, Hà Nội"
Công Ty Xây Dựng Á Châu,"Công Ty Xây Dựng Á Châu, 30 P. Nguyễn Thái Học, Điện Biên, Đống Đa, Hà Nội"
Công ty Chí Anh,"2RCH+X74 Công ty Chí Anh, Hàng Bột, Đống Đa, Hà Nội"
Công ty In Thuận Phát,"Công ty In Thuận Phát, 120 P. Định Công, Phương Liệt, Thanh Xuân, Hà Nội"
Công ty TNHH một thành viên Muối Việt Nam,"Công ty TNHH một thành viên Muối Việt Nam, 7 P. Hàng Gà, Hàng Bồ, Hoàn Kiếm, Hà Nội"
Công ty Xuất nhập khẩu đầu tư và Thương mại An Bình,"Công ty Xuất nhập khẩu đầu tư và Thương mại An Bình, Lô số 7, Đền Lừ, III, Hoàng Văn Thụ, Hoàng Mai, Hà Nội"
Công ty Lữ hành Hanoitourist,"Công ty Lữ hành Hanoitourist, 18 P. Lý Thường Kiệt, Phan Chu Trinh, Hoàn Kiếm, Hà Nội 100000"
